{
  "protocol_version": "1.0.0",
  "bundle_id": "fixture-acme-panel-v1",
  "subject": {"name": "Acme", "aliases": ["Acme"], "target_source_uris": ["https://acme.example/evidence"]},
  "panel": {
    "panel_version": "panel-v1",
    "queries": [
      {"query_id": "q1", "query_text": "What is Acme?", "intent": "brand"},
      {"query_id": "q2", "query_text": "Best category provider", "intent": "category"},
      {"query_id": "q3", "query_text": "Compare category providers", "intent": "compare"},
      {"query_id": "q4", "query_text": "Evaluate provider evidence", "intent": "evaluate"},
      {"query_id": "q5", "query_text": "Choose a provider", "intent": "act"}
    ],
    "expected_engines": ["openai", "perplexity"],
    "expected_timepoints": ["baseline", "post"],
    "expected_repetitions": 1
  },
  "collection": {"collector": "GEOHub fixture", "permission_scope": "synthetic recorded fixture", "source_note": "No external platform data."},
  "observations": [
    {"observation_id":"openai-baseline-q1-r1","engine":"openai","model":"fixture-model","query_id":"q1","query_text":"What is Acme?","answer_text":"Acme is an evidence-backed provider.","citations":[{"uri":"https://acme.example/evidence","position":1},{"uri":"https://other.example/source","position":2}],"observed_at":"2026-08-10T08:00:00Z","locale":"en-US","session_policy":"anonymous-clean-session","panel_version":"panel-v1","collection_method":"recorded_fixture","timepoint":"baseline","repetition":1},
    {"observation_id":"openai-baseline-q2-r1","engine":"openai","model":"fixture-model","query_id":"q2","query_text":"Best category provider","answer_text":"Acme is one provider to evaluate.","citations":[{"uri":"https://acme.example/evidence","position":1}],"observed_at":"2026-08-10T08:01:00Z","locale":"en-US","session_policy":"anonymous-clean-session","panel_version":"panel-v1","collection_method":"recorded_fixture","timepoint":"baseline","repetition":1},
    {"observation_id":"openai-baseline-q3-r1","engine":"openai","model":"fixture-model","query_id":"q3","query_text":"Compare category providers","answer_text":"Compare Acme with alternatives using evidence.","citations":[],"observed_at":"2026-08-10T08:02:00Z","locale":"en-US","session_policy":"anonymous-clean-session","panel_version":"panel-v1","collection_method":"recorded_fixture","timepoint":"baseline","repetition":1},
    {"observation_id":"openai-baseline-q4-r1","engine":"openai","model":"fixture-model","query_id":"q4","query_text":"Evaluate provider evidence","answer_text":"Use primary documentation and independent sources.","citations":[{"uri":"https://other.example/source","position":1}],"observed_at":"2026-08-10T08:03:00Z","locale":"en-US","session_policy":"anonymous-clean-session","panel_version":"panel-v1","collection_method":"recorded_fixture","timepoint":"baseline","repetition":1},
    {"observation_id":"openai-baseline-q5-r1","engine":"openai","model":"fixture-model","query_id":"q5","query_text":"Choose a provider","answer_text":"Choose with verified requirements and references.","citations":[],"observed_at":"2026-08-10T08:04:00Z","locale":"en-US","session_policy":"anonymous-clean-session","panel_version":"panel-v1","collection_method":"recorded_fixture","timepoint":"baseline","repetition":1},
    {"observation_id":"openai-post-q1-r1","engine":"openai","model":"fixture-model","query_id":"q1","query_text":"What is Acme?","answer_text":"Acme is an evidence-backed provider.","citations":[{"uri":"https://acme.example/evidence","position":1},{"uri":"https://other.example/source","position":2}],"observed_at":"2026-08-11T08:00:00Z","locale":"en-US","session_policy":"anonymous-clean-session","panel_version":"panel-v1","collection_method":"recorded_fixture","timepoint":"post","repetition":1},
    {"observation_id":"openai-post-q2-r1","engine":"openai","model":"fixture-model","query_id":"q2","query_text":"Best category provider","answer_text":"Acme is one provider to evaluate.","citations":[{"uri":"https://acme.example/evidence","position":1}],"observed_at":"2026-08-11T08:01:00Z","locale":"en-US","session_policy":"anonymous-clean-session","panel_version":"panel-v1","collection_method":"recorded_fixture","timepoint":"post","repetition":1},
    {"observation_id":"openai-post-q3-r1","engine":"openai","model":"fixture-model","query_id":"q3","query_text":"Compare category providers","answer_text":"Compare Acme with alternatives using evidence.","citations":[],"observed_at":"2026-08-11T08:02:00Z","locale":"en-US","session_policy":"anonymous-clean-session","panel_version":"panel-v1","collection_method":"recorded_fixture","timepoint":"post","repetition":1},
    {"observation_id":"openai-post-q4-r1","engine":"openai","model":"fixture-model","query_id":"q4","query_text":"Evaluate provider evidence","answer_text":"Use primary documentation and independent sources.","citations":[{"uri":"https://other.example/source","position":1}],"observed_at":"2026-08-11T08:03:00Z","locale":"en-US","session_policy":"anonymous-clean-session","panel_version":"panel-v1","collection_method":"recorded_fixture","timepoint":"post","repetition":1},
    {"observation_id":"openai-post-q5-r1","engine":"openai","model":"fixture-model","query_id":"q5","query_text":"Choose a provider","answer_text":"Choose with verified requirements and references.","citations":[],"observed_at":"2026-08-11T08:04:00Z","locale":"en-US","session_policy":"anonymous-clean-session","panel_version":"panel-v1","collection_method":"recorded_fixture","timepoint":"post","repetition":1},
    {"observation_id":"perplexity-baseline-q1-r1","engine":"perplexity","model":"fixture-model","query_id":"q1","query_text":"What is Acme?","answer_text":"Acme is an evidence-backed provider.","citations":[{"uri":"https://acme.example/evidence","position":1},{"uri":"https://other.example/source","position":2}],"observed_at":"2026-08-10T09:00:00Z","locale":"en-US","session_policy":"anonymous-clean-session","panel_version":"panel-v1","collection_method":"recorded_fixture","timepoint":"baseline","repetition":1},
    {"observation_id":"perplexity-baseline-q2-r1","engine":"perplexity","model":"fixture-model","query_id":"q2","query_text":"Best category provider","answer_text":"Acme is one provider to evaluate.","citations":[{"uri":"https://acme.example/evidence","position":1}],"observed_at":"2026-08-10T09:01:00Z","locale":"en-US","session_policy":"anonymous-clean-session","panel_version":"panel-v1","collection_method":"recorded_fixture","timepoint":"baseline","repetition":1},
    {"observation_id":"perplexity-baseline-q3-r1","engine":"perplexity","model":"fixture-model","query_id":"q3","query_text":"Compare category providers","answer_text":"Compare Acme with alternatives using evidence.","citations":[],"observed_at":"2026-08-10T09:02:00Z","locale":"en-US","session_policy":"anonymous-clean-session","panel_version":"panel-v1","collection_method":"recorded_fixture","timepoint":"baseline","repetition":1},
    {"observation_id":"perplexity-baseline-q4-r1","engine":"perplexity","model":"fixture-model","query_id":"q4","query_text":"Evaluate provider evidence","answer_text":"Use primary documentation and independent sources.","citations":[{"uri":"https://other.example/source","position":1}],"observed_at":"2026-08-10T09:03:00Z","locale":"en-US","session_policy":"anonymous-clean-session","panel_version":"panel-v1","collection_method":"recorded_fixture","timepoint":"baseline","repetition":1},
    {"observation_id":"perplexity-baseline-q5-r1","engine":"perplexity","model":"fixture-model","query_id":"q5","query_text":"Choose a provider","answer_text":"Choose with verified requirements and references.","citations":[],"observed_at":"2026-08-10T09:04:00Z","locale":"en-US","session_policy":"anonymous-clean-session","panel_version":"panel-v1","collection_method":"recorded_fixture","timepoint":"baseline","repetition":1},
    {"observation_id":"perplexity-post-q1-r1","engine":"perplexity","model":"fixture-model","query_id":"q1","query_text":"What is Acme?","answer_text":"Acme is an evidence-backed provider.","citations":[{"uri":"https://acme.example/evidence","position":1},{"uri":"https://other.example/source","position":2}],"observed_at":"2026-08-11T09:00:00Z","locale":"en-US","session_policy":"anonymous-clean-session","panel_version":"panel-v1","collection_method":"recorded_fixture","timepoint":"post","repetition":1},
    {"observation_id":"perplexity-post-q2-r1","engine":"perplexity","model":"fixture-model","query_id":"q2","query_text":"Best category provider","answer_text":"Acme is one provider to evaluate.","citations":[{"uri":"https://acme.example/evidence","position":1}],"observed_at":"2026-08-11T09:01:00Z","locale":"en-US","session_policy":"anonymous-clean-session","panel_version":"panel-v1","collection_method":"recorded_fixture","timepoint":"post","repetition":1},
    {"observation_id":"perplexity-post-q3-r1","engine":"perplexity","model":"fixture-model","query_id":"q3","query_text":"Compare category providers","answer_text":"Compare Acme with alternatives using evidence.","citations":[],"observed_at":"2026-08-11T09:02:00Z","locale":"en-US","session_policy":"anonymous-clean-session","panel_version":"panel-v1","collection_method":"recorded_fixture","timepoint":"post","repetition":1},
    {"observation_id":"perplexity-post-q4-r1","engine":"perplexity","model":"fixture-model","query_id":"q4","query_text":"Evaluate provider evidence","answer_text":"Use primary documentation and independent sources.","citations":[{"uri":"https://other.example/source","position":1}],"observed_at":"2026-08-11T09:03:00Z","locale":"en-US","session_policy":"anonymous-clean-session","panel_version":"panel-v1","collection_method":"recorded_fixture","timepoint":"post","repetition":1},